{
  "id": "adri-irn-v1.1",
  "version": "v1.1",
  "importedAt": "2026-06-23T14:39:48.063726+00:00",
  "source": {
    "type": "gitlab",
    "url": "https://gitlab.com/digitalresilienceinitiative/adri-irn",
    "projectPath": "digitalresilienceinitiative/adri-irn",
    "defaultBranch": "main",
    "filePath": "Grille d'évaluation IRN (FR)/xlsx/Questionnaire_IRN_v.1.1.xlsx",
    "commitSha": null,
    "checksumSha256": "f8997cdec98a29c35b25190ba8756e8bd9470967ded2cab31e6c0b57c14e3047",
    "license": "CC BY-NC-ND 4.0"
  },
  "pillars": [
    {
      "id": "RES-1",
      "code": "RES-1",
      "label": "Résilience stratégique"
    },
    {
      "id": "RES-2",
      "code": "RES-2",
      "label": "Résilience économique et juridique"
    },
    {
      "id": "RES-3",
      "code": "RES-3",
      "label": "Résilience Data & IA"
    },
    {
      "id": "RES-4",
      "code": "RES-4",
      "label": "Résilience opérationnelle"
    },
    {
      "id": "RES-5",
      "code": "RES-5",
      "label": "Résilience Supply-Chain"
    },
    {
      "id": "RES-6",
      "code": "RES-6",
      "label": "Résilience Technologique"
    },
    {
      "id": "RES-7",
      "code": "RES-7",
      "label": "Sécurité & Résilience"
    },
    {
      "id": "RES-8",
      "code": "RES-8",
      "label": "Résilience Environnementale et énergétique"
    }
  ],
  "criteria": [
    {
      "id": "RES-1.1",
      "code": "RES-1.1",
      "sourceCode": "RES-1.1",
      "pillarId": "RES-1",
      "label": "Une gouvernance du numérique efficace",
      "shortLabel": "",
      "description": "Une gouvernance du numérique à l’état de l'art formalisée et contrôlée pour pérenniser les actions de résilience",
      "scope": "organization",
      "sourceScope": "Fonction ou organisation",
      "answerMode": "R_NR",
      "regulatoryReferences": "",
      "recommendations": "Intention : La gouvernance du numérique est formalisée. Des instances de partage et d'arbitrage existent Moyens : La gouvernance du numérique est alignée sur les bonne pratiques, connue et mise en oeuvre par les partie prenantes avec implication du comex Résultats : La performance de la gouvernance (cf. Magnum) est mesurée. Les actions d'amélioration sont suivies en comex",
      "active": true,
      "source": {
        "sheet": "Référentiel v1",
        "row": 5
      }
    },
    {
      "id": "RES-1.2",
      "code": "RES-1.2",
      "sourceCode": "RES-1.2",
      "pillarId": "RES-1",
      "label": "Sponsoring exécutif concernant la résilience et la dépendance numérique",
      "shortLabel": "Sponsoring exécutif sur la dépendance numérique",
      "description": "Mettre en place un sponsoring explicite et actif (COMEX / Conseil / CoRisk) sur la résilience et les dépendances numériques afin d’arbitrer, au bon niveau, les risques, les investissements et les choix d’architecture/sourcing liés aux services critiques.",
      "scope": "organization",
      "sourceScope": "Fonction ou organisation",
      "answerMode": "R_NR",
      "regulatoryReferences": "Directive (EU) 2022/2555 (NIS2) Directive (EU) 2022/2557 (CER – Critical Entities Résilience) Régulation (EU) 2022/2554 (DORA)",
      "recommendations": "Intention : La résilience et les dépendances numériques figurent à l’ordre du jour du COMEX/Conseil, comité d'audit, risque au moins une fois par an, avec des décisions formalisées. Moyens : Produire des reporting réguliers (cartographie des dépendances, KPIs, incidents, plans d’action), organiser des revues d’architecture/sourcing, test de résilience, et sensibiliser les dirigeants (formation, séminaire, expert externe). Résultats : La résilience numérique est intégrée aux priorités stratégiques et se traduit par des décisions d’investissement, de diversification, de désengagement ou de ré‑architecturation.",
      "active": true,
      "source": {
        "sheet": "Référentiel v1",
        "row": 6
      }
    },
    {
      "id": "RES-1.3",
      "code": "RES-1.3",
      "sourceCode": "RES-1.3",
      "pillarId": "RES-1",
      "label": "Gouvernance des usages numériques en libre service",
      "shortLabel": "Gouvernance du citizen AI",
      "description": "Encadrer l'usage des outils en libre‑service (automatisations, modèles locaux) afin de permettre l’innovation tout en maîtrisant les risques (sécurité, qualité, conformité, shadow IT).",
      "scope": "organization",
      "sourceScope": "Fonction ou organisation",
      "answerMode": "R_NR",
      "regulatoryReferences": "Regulation (EU) 2024/1689 (AI Act) Regulation (EU) 2016/679 (GDPR) Directive (EU) 2022/2555 (NIS2)",
      "recommendations": "Intention : Définir un cadre clair pour les usages des outils en libre-service (automatisations, modèles ou analyses développés hors des équipes IT/DSI), en précisant les périmètres autorisés, les données et traitements éligibles, les niveaux de risque acceptables et les responsabilités des utilisateurs. Moyens : mettre à disposition des utilisateurs des outils référencés, sécurisés et adaptés aux usages usages des outils en libre-service (catalogue), déployer des garde-fous techniques (contrôles d’accès, DLP, environnements sandbox, MLOps simplifié le cas échéant), former les utilisateurs et organiser un processus de validation ou d’escalade pour les cas d’usage à risque ou sensibles. Résultats : les usages des outils en libre-service sont majoritairement réalisés via des solutions référencées et encadrées ; les usages non conformes ou hors cadre sont détectés et suivis ; les risques (sécurité, conformité, qualité des données) et les bénéfices (gain de productivité, innovation) sont mesurés et pilotés dans la durée.",
      "active": true,
      "source": {
        "sheet": "Référentiel v1",
        "row": 7
      }
    },
    {
      "id": "RES-1.4",
      "code": "RES-1.4",
      "sourceCode": "RES-1.4",
      "pillarId": "RES-1",
      "label": "Gouvernance data et/ou IA",
      "shortLabel": "Souveraineté de la stack IA",
      "description": "Définir une gouvernance claire data et/ou IA (rôles, responsabilités, politiques, contrôles) pour assurer qualité, sécurité, conformité, traçabilité et alignement métier sur les cas d’usage critiques.",
      "scope": "organization",
      "sourceScope": "Fonction ou organisation",
      "answerMode": "R_NR",
      "regulatoryReferences": "Regulation (EU) 2024/1689 (AI Act) Regulation (EU) 2016/679 (GDPR) Regulation (EU) 2022/868 (Data Governance Act) Directive (EU) 2022/2555 (NIS2)",
      "recommendations": "Intention : Une gouvernance data/IA est formalisée (instances, RACI, politiques) et appliquée aux cas d’usage et plateformes critiques. Moyens : Mettre en place un référentiel (données, modèles, jeux d’entraînement), des contrôles de qualité et de sécurité, une gestion des accès, une documentation (data lineage, model cards), ainsi que des revues éthiques et de conformité. Résultats : Adoption facilitée par les métiers ; décisions et responsabilités traçables ; indicateurs de qualité/risque suivis et actions correctives pilotées.",
      "active": true,
      "source": {
        "sheet": "Référentiel v1",
        "row": 8
      }
    },
    {
      "id": "RES-2.1",
      "code": "RES-2.1",
      "sourceCode": "RES-2.1",
      "pillarId": "RES-2",
      "label": "Localisation géographique et nationalité de la maison mère du fournisseur (interne ou externe)",
      "shortLabel": "Localisation de l’autorité décisionnelle (territorialité et maison mère du fournisseur)",
      "description": "S’assurer que l’autorité décisionnelle et l’entité juridique qui délivre le service (ou opère le produit) sont localisées et/ou soumises, dans/à une juridiction compatible avec les exigences de l’organisation (idéalement UE/EEE), afin de réduire les risques liés à la souveraineté, à la conformité et à la continuité.",
      "scope": "asset",
      "sourceScope": "Actif numérique",
      "answerMode": "R_NR",
      "regulatoryReferences": "Directive (EU) 2022/2555 (NIS2) Directive (EU) 2022/2557 (CER – Critical Entities Resilience) Regulation (EU) 2016/679 (GDPR) Regulation (EU) 2022/2554 (DORA)",
      "recommendations": "Intention : Cartographier, pour chaque service numérique critique, la localisation (pays) de la maison mère, des entités opérantes et des centres de décision. Moyens : Intégrer dans les politiques d’achats et les modèles contractuels des exigences de droit applicable, de localisation (UE/EEE si requis) et de notification en cas de changement de contrôle ou de localisation. Résultats : 100 % des services critiques sont pilotés depuis une juridiction acceptable ; toute dérogation est exceptionnelle, documentée, compensée (mesures techniques/contractuelles) et revue périodiquement.",
      "active": true,
      "source": {
        "sheet": "Référentiel v1",
        "row": 9
      }
    },
    {
      "id": "RES-2.2",
      "code": "RES-2.2",
      "sourceCode": "RES-2.2",
      "pillarId": "RES-2",
      "label": "Conformité à la réglementation nationale (ou supranationale) de l'actif ou service numérique",
      "shortLabel": "Conformité réglementaire européenne",
      "description": "Vérifier et démontrer que les services numériques critiques respectent les obligations légales et réglementaires applicables (UE et nationales), et que cette conformité est maintenue dans le temps en prenant en compte les évolutions de texte ou de périmètre.",
      "scope": "asset",
      "sourceScope": "Actif numérique",
      "answerMode": "R_NR",
      "regulatoryReferences": "Directive (EU) 2022/2555 (NIS2) Regulation (EU) 2022/2554 (DORA) Regulation (EU) 2016/679 (GDPR)",